J,"O'Brien, SJ; Larose, TL; Adak, GK; Evans, MR; Tam, CC",,,,"O'Brien, Sarah J.; Larose, Tricia L.; Adak, Goutam K.; Evans, Meirion R.; Tam, Clarence C.",,Foodborne Dis Attribution Study,"Modelling study to estimate the health burden of foodborne diseases: cases, general practice consultations and hospitalisations in the UK, 2009",BMJ OPEN,,,,Article,,,,,,,,"Objective: To generate estimates of the burden of UK-acquired foodborne disease accounting for uncertainty. Design: A modelling study combining data from national public health surveillance systems for laboratory-confirmed infectious intestinal disease (IID) and outbreaks of foodborne disease and 2 prospective, population-based studies of IID in the community. The underlying data sets covered the time period 1993-008. We used Monte Carlo simulation and a Bayesian approach, using a systematic review to generate Bayesian priors. We calculated point estimates with 95% credible intervals (CrI). Setting: UK, 2009. Outcome measures: Pathogen-specific estimates of the number of cases, general practice (GP) consultations and hospitalisations for foodborne disease in the UK in 2009. Results: Bayesian approaches gave slightly more conservative estimates of overall health burden (similar to 511 000 cases vs 566 000 cases). Campylobacter is the most common foodborne pathogen, causing 280 400 (95% CrI 182 503-435 693) food-related cases and 38 860 (95% CrI 27 160-55 610) GP consultations annually. Despite this, there are only around 562 (95% CrI 189-1330) food-related hospital admissions due to Campylobacter, reflecting relatively low disease severity. Salmonella causes the largest number of hospitalisations, an estimated 2490 admissions (95% CrI 607-9631), closely followed by Escherichia coli O157 with 2233 admissions (95% CrI 170-32 159). Other common causes of foodborne disease include Clostridium perfringens, with an estimated 79 570 cases annually (95% CrI 30 700-211 298) and norovirus with 74 100 cases (95% CrI 61 150-89 660). Other viruses and protozoa ranked much lower as causes of foodborne disease. Conclusions: The 3 models yielded similar estimates of the burden of foodborne illness in the UK and show that continued reductions in Campylobacter, Salmonella, E. coli O157, C. perfringens and norovirus are needed to mitigate the impact of foodborne disease.","[O'Brien, Sarah J.] Univ Liverpool, Inst Infect & Global Hlth, Liverpool, Merseyside, England; [O'Brien, Sarah J.] Univ Liverpool, NIHR Hlth Protect Res Unit Gastrointestinal Infec, Farr Inst HeRC, Liverpool, Merseyside, England; [Larose, Tricia L.; Tam, Clarence C.] London Sch Hyg & Trop Med, Dept Infect Dis Epidemiol, London, England; [Larose, Tricia L.] Norwegian Univ Sci & Technol, Dept Publ Hlth & Gen Practice, Trondheim, Norway; [Adak, Goutam K.] Publ Hlth England Ctr Infect Dis Surveillance & C, Dept Gastrointestinal Emerging & Zoonot Infect, London, England; [Evans, Meirion R.] Cardiff Univ, Inst Primary Care & Publ Hlth, Cardiff, Wales; [Tam, Clarence C.] Natl Univ Singapore, Saw Swee Hock Sch Publ Hlth, Singapore, Singapore",University of Liverpool; University of Liverpool; University of London; London School of Hygiene & Tropical Medicine; Norwegian University of Science & Technology (NTNU); Public Health England; Cardiff University; National University of Singapore,"O'Brien, SJ (corresponding author), Univ Liverpool, Inst Infect & Global Hlth, Liverpool, Merseyside, England.;O'Brien, SJ (corresponding author), Univ Liverpool, NIHR Hlth Protect Res Unit Gastrointestinal Infec, Farr Inst HeRC, Liverpool, Merseyside, England.",s.j.obrien@liverpool.ac.uk,,,,,,,,23,23,,,,,,,,,,,,2016,6,9,,,,,,,e011119,10.1136/bmjopen-2016-011119,http://dx.doi.org/10.1136/bmjopen-2016-011119,,,,,,,,,,,,2024-11-27,WOS:000391302900144,View Full Record in Web of Science
J,"Ackerley, L",,,,"Ackerley, Lisa",,,The journey of the germ: commentary on routes of infection and targeted hand hygiene,PERSPECTIVES IN PUBLIC HEALTH,,,,Article,,,,,,,,,"[Ackerley, Lisa] RSPH, London, England",,"Ackerley, L (corresponding author), Univ Salford, Environm Hlth, Salford M5 4WT, Lancs, England.",,,,,,,,,1,1,,,,,,,,,,,NOV,2015,135,6,,,,,279,281,,10.1177/1757913915606644,http://dx.doi.org/10.1177/1757913915606644,,,,,,,,,,,,2024-11-27,WOS:000364722700011,View Full Record in Web of Science
J,"Hansdotter, FI; Magnusson, M; Kühlmann-Berenzon, S; Hulth, A; Sundström, K; Hedlund, KO; Andersson, Y",,,,"Hansdotter, Frida I.; Magnusson, Mans; Kuhlmann-Berenzon, Sharon; Hulth, Anette; Sundstrom, Kristian; Hedlund, Kjell-Olof; Andersson, Yvonne",,,The incidence of acute gastrointestinal illness in Sweden,SCANDINAVIAN JOURNAL OF PUBLIC HEALTH,,,,Article,,,,,,,,"Aims: The aim of this study was to estimate the self-reported domestic incidence of acute gastrointestinal illness in the Swedish population irrespective of route of transmission or type of pathogen causing the disease. Previous studies in Sweden have primarily focused on incidence of acute gastrointestinal illness related to consumption of contaminated food and drinking water. Methods: In May 2009, we sent a questionnaire to 4000 randomly selected persons aged 0-85 years, asking about the number of episodes of stomach disease during the last 12 months. To validate the data on symptoms, we compared the study results with anonymous queries submitted to a Swedish medical website. Results: The response rate was 64%. We estimated that a total number of 2744,778 acute gastrointestinal illness episodes (95% confidence intervals 2475,641-3013,915) occurred between 1 May 2008 and 30 April 2009. Comparing the number of reported episodes with web queries indicated that the low number of episodes during the first 6 months was an effect of seasonality rather than recall bias. Further, the result of the recall bias analysis suggested that the survey captured approximately 65% of the true number of episodes among the respondents. Conclusions: The estimated number of Swedish acute gastrointestinal illness cases in this study is about five times higher than previous estimates. This study provides valuable information on the incidence of gastrointestinal symptoms in Sweden, irrespective of route of transmission, indicating a high burden of acute gastrointestinal illness, especially among children, and large societal costs, primarily due to production losses.","[Hansdotter, Frida I.] Publ Hlth Agcy Sweden, Dept Knowledge Dev, SE-17182 Solna, Sweden; [Magnusson, Mans] Linkoping Univ, Dept Comp & Informat Sci, S-58183 Linkoping, Sweden; [Kuhlmann-Berenzon, Sharon; Hulth, Anette] Publ Hlth Agcy Sweden, Dept Monitoring & Evaluat, SE-17182 Solna, Sweden; [Sundstrom, Kristian] Lund Univ, Inst Food & Agr Econ, S-22100 Lund, Sweden; [Hedlund, Kjell-Olof; Andersson, Yvonne] Swedish Inst Communicable Dis Control, Linkoping, Sweden",Public Health Agency of Sweden; Linkoping University; Public Health Agency of Sweden; Lund University; Swedish Institute for Infectious Disease Control,"Hulth, A (corresponding author), Publ Hlth Agcy Sweden, SE-17182 Solna, Sweden.",anette.hulth@folkhalsomyndigheten.se,,,,,,,,17,20,,,,,,,,,,,JUL,2015,43,5,,,,,540,547,,10.1177/1403494815576787,http://dx.doi.org/10.1177/1403494815576787,,,,,,,,,,,,2024-11-27,WOS:000357581300014,View Full Record in Web of Science
J,"Jones, PH; Dawson, S; Gaskell, RM; Coyne, KP; Tierney, A; Setzkorn, C; Radford, AD; Noble, PJM",,,,"Jones, P. H.; Dawson, S.; Gaskell, R. M.; Coyne, K. P.; Tierney, A.; Setzkorn, C.; Radford, A. D.; Noble, P. -J. M.",,,Surveillance of diarrhoea in small animal practice through the Small Animal Veterinary Surveillance Network (SAVSNET),VETERINARY JOURNAL,,,,Article,,,,,,,,"Using the Small Animal Veterinary Surveillance Network (SAVSNET), a national small animal disease-surveillance scheme, information on gastrointestinal disease was collected for a total of 76 days between 10 May 2010 and 8 August 2011 from 16,223 consultations (including data from 9115 individual dogs and 3462 individual cats) from 42 premises belonging to 19 UK veterinary practices. During that period, 7% of dogs and 3% of cats presented with diarrhoea. Adult dogs had a higher proportional morbidity of diarrhoea (PMD) than adult cats (P<0.001). This difference was not observed in animals<1 year old. Younger animals in both species had higher PMDs than adult animals (P<0.001). Neutering was associated with reduced PMD in young male dogs. In adult dogs, miniature Schnauzers had the highest PMD. Most animals with diarrhoea (51%) presented having been ill for 2-4 days, but a history of vomiting or haemorrhagic diarrhoea was associated with a shorter time to presentation. The most common treatments employed were dietary modification (66% of dogs; 63% of cats) and antibacterials (63% of dogs; 49% of cats). There was variability in PMD between different practices. The SAVNET methodology facilitates rapid collection of cross-sectional data regarding diarrhoea, a recognised sentinel for infectious disease, and characterises data that could benchmark clinical practice and support the development of evidence-based medicine. (C) 2014 Elsevier Ltd. All rights reserved.","[Jones, P. H.; Gaskell, R. M.; Coyne, K. P.; Tierney, A.; Setzkorn, C.; Radford, A. D.] Univ Liverpool, Inst Global Hlth, Neston CH64 7TE, Cheshire, England; [Jones, P. H.] Natl Consortium Zoonosis Res, Neston CH64 7TE, Cheshire, England; [Dawson, S.; Noble, P. -J. M.] Univ Liverpool, Sch Vet Sci, Neston CH64 7TE, Cheshire, England",University of Liverpool; University of Liverpool,"Noble, PJM (corresponding author), Univ Liverpool, Sch Vet Sci, Leahurst Campus,Chester High Rd, Neston CH64 7TE, Cheshire, England.",rtnorle@liv.ac.uk,,,,,,,,42,45,,,,,,,,,,,SEP,2014,201,3,,,,,412,418,,10.1016/j.tvjl.2014.05.044,http://dx.doi.org/10.1016/j.tvjl.2014.05.044,,,,,,,,,,,,2024-11-27,WOS:000342711600031,View Full Record in Web of Science
J,"Grilc, E; Socan, M",,,,"Grilc, Eva; Socan, Maja",,,POPULATION BASED SELF-REPORTED ACUTE GASTROINTESTINAL INFECTION IN SLOVENIA: MULTIPLIER STUDY,ZDRAVSTVENO VARSTVO,,,,Article,,,,,,,,"Background: The assessment of the incidence of acute gastrintestinal infections (AGI) derived from the notifications underestimates the real burden of AGI. The symptoms of AGI are usually not severe enough for consultation with a physician. The more exact data on the burden of AGI are gained through cross sectional population-based studies. To estimate the burden of AGI in Slovenia, a period prevalence study was conducted. Methods: A simple random sample consisting of 5000 Slovenian inhabitants was chosen to whom a questionnaire was sent in July 2011. The participants were asked if they experienced AGI in June 2011 according to a symptom-based case definition. The participants were asked to fill in the questionnaire on a paper or via a web page created for study purposes. Results: Out of 5000 participants, 1500 filled out the questionnaire, giving a response rate of 33%. The number of women responding out-numbered men - there were 58% female and 42% male responders. 66 (4.4%) of the responders claimed to have had AGI in June 2011. The incidence rate of acute AGI was therefore 4400 per 100,000 inhabitants. Comparatively, the incidence rate of notified cases in the same month was 78.9 per 100,000 inhabitants. The difference between the incidence of AGI, based on notified cases and incidence, calculated in the first Slovenian cross sectional study, showed that one out of 56 cases of AGI in the community has been notified. Conclusion: the incidence of AGI among the Slovenian population, based on data from our cross sectional study, is as expected higher than the incidence calculated from notification data from the same period.","[Grilc, Eva; Socan, Maja] Inst Publ Hlth Republ Slovenia, Ljubljana 1000, Slovenia",,"Grilc, E (corresponding author), Inst Publ Hlth Republ Slovenia, Trubarjeva 2, Ljubljana 1000, Slovenia.",eva.grilc@ivz-rs.si,,,,,,,,3,3,,,,,,,,,,,JUN,2014,53,2,,,,,125,132,,10.2478/sjph-2014-0013,http://dx.doi.org/10.2478/sjph-2014-0013,,,,,,,,,,,,2024-11-27,WOS:000334849700001,View Full Record in Web of Science
J,"Gibbons, CL; Mangen, MJJ; Plass, D; Havelaar, AH; Brooke, RJ; Kramarz, P; Peterson, KL; Stuurman, AL; Cassini, A; Fèvre, EM; Kretzschmar, MEE",,,,"Gibbons, Cheryl L.; Mangen, Marie-Josee J.; Plass, Dietrich; Havelaar, Arie H.; Brooke, Russell John; Kramarz, Piotr; Peterson, Karen L.; Stuurman, Anke L.; Cassini, Alessandro; Fevre, Eric M.; Kretzschmar, Mirjam E. E.",,Burden Communicable Dis Europe BCo,Measuring underreporting and under-ascertainment in infectious disease datasets: a comparison of methods,BMC PUBLIC HEALTH,,,,Article,,,,,,,,"Background: Efficient and reliable surveillance and notification systems are vital for monitoring public health and disease outbreaks. However, most surveillance and notification systems are affected by a degree of underestimation (UE) and therefore uncertainty surrounds the 'true' incidence of disease affecting morbidity and mortality rates. Surveillance systems fail to capture cases at two distinct levels of the surveillance pyramid: from the community since not all cases seek healthcare (under-ascertainment), and at the healthcare-level, representing a failure to adequately report symptomatic cases that have sought medical advice (underreporting). There are several methods to estimate the extent of under-ascertainment and underreporting. Methods: Within the context of the ECDC-funded Burden of Communicable Diseases in Europe (BCoDE)-project, an extensive literature review was conducted to identify studies that estimate ascertainment or reporting rates for salmonellosis and campylobacteriosis in European Union Member States (MS) plus European Free Trade Area (EFTA) countries Iceland, Norway and Switzerland and four other OECD countries (USA, Canada, Australia and Japan). Multiplication factors (MFs), a measure of the magnitude of underestimation, were taken directly from the literature or derived (where the proportion of underestimated, under-ascertained, or underreported cases was known) and compared for the two pathogens. Results: MFs varied between and within diseases and countries, representing a need to carefully select the most appropriate MFs and methods for calculating them. The most appropriate MFs are often disease-,country-, age-, and sex-specific. Conclusions: When routine data are used to make decisions on resource allocation or to estimate epidemiological parameters in populations, it becomes important to understand when, where and to what extent these data represent the true picture of disease, and in some instances (such as priority setting) it is necessary to adjust for underestimation. MFs can be used to adjust notification and surveillance data to provide more realistic estimates of incidence.","[Gibbons, Cheryl L.; Peterson, Karen L.] Univ Edinburgh, Ctr Immun Infect & Evolut, Ashworth Labs, Edinburgh, Midlothian, Scotland; [Mangen, Marie-Josee J.; Brooke, Russell John; Kretzschmar, Mirjam E. E.] Univ Med Ctr Utrecht, Julius Ctr Hlth Sci & Primary Care, Utrecht, Netherlands; [Plass, Dietrich] Univ Bielefeld, Sch Publ Hlth, Dept Publ Hlth Med, D-33615 Bielefeld, Germany; [Havelaar, Arie H.; Kretzschmar, Mirjam E. E.] Natl Inst Publ Hlth & Environm, Ctr Infect Dis Control, NL-3720 BA Bilthoven, Netherlands; [Havelaar, Arie H.] Univ Utrecht, Inst Risk Assessment Sci, Utrecht, Netherlands; [Kramarz, Piotr] European Ctr Dis Prevent & Control, Stockholm, Sweden; [Stuurman, Anke L.] Hlth Res & Consultancy BV, Pallas, Rotterdam, Netherlands; [Fevre, Eric M.] Int Livestock Res Inst, Nairobi, Kenya; [Fevre, Eric M.] Univ Liverpool, Inst Infect & Global Hlth, Liverpool L69 3BX, Merseyside, England",University of Edinburgh; Utrecht University; Utrecht University Medical Center; University of Bielefeld; Netherlands National Institute for Public Health & the Environment; Utrecht University; European Centre for Disease Prevention & Control; CGIAR; International Livestock Research Institute (ILRI); University of Liverpool,"Gibbons, CL (corresponding author), Univ Edinburgh, Ctr Immun Infect & Evolut, Ashworth Labs, Kings Bldg, Edinburgh, Midlothian, Scotland.",C.L.Gibbons@sms.ed.ac.uk,,,,,,,,248,277,,,,,,,,,,,FEB 11,2014,14,,,,,,,,147,10.1186/1471-2458-14-147,http://dx.doi.org/10.1186/1471-2458-14-147,,,,,,,,,,,,2024-11-27,WOS:000332717200002,View Full Record in Web of Science
J,"David, JM; Ravel, A; Nesbitt, A; Pintar, K; Pollari, F",,,,"David, J. M.; Ravel, A.; Nesbitt, A.; Pintar, K.; Pollari, F.",,,"Assessing multiple foodborne, waterborne and environmental exposures of healthy people to potential enteric pathogen sources: effect of age, gender, season, and recall period",EPIDEMIOLOGY AND INFECTION,,,,Article,,,,,,,,"Information is lacking in Canada on the frequency of exposures of healthy people to enteric pathogen sources (i.e. water, food, animal contact) at the community level. This information is critical to develop more robust risk assessments and prioritize control measures. A 12-month-long cross-sectional telephone survey of 1200 healthy individuals in a sentinel community was performed. Survey respondents were divided into three recall period groups (3, 7, 14 days). The occurrence of 46 exposures (including water, animal contact, environmental contact and high-risk foods) was assessed per recall period. Effect of age, gender, and season on exposures was modelled and frequencies of exposure were extrapolated. Thirty-five exposures had similar occurrences across recall periods. Age was significant for 23 exposures, season for 18, and gender for three. Exposures that vary by age and season (i.e. bottled water, swimming, etc.) warrant consideration when investigating and analysing cases of enteric illness.","[David, J. M.; Ravel, A.] Univ Montreal, Publ Hlth Agcy Canada, Lab Foodborne Zoonoses, C EnterNet Surveillance, St Hyacinthe, PQ, Canada; [David, J. M.; Ravel, A.] Univ Montreal, Fac Vet Med, Grp Rech Epidemiol Zoonoses & Sante Publ, St Hyacinthe, PQ J2S 7C6, Canada; [Nesbitt, A.; Pollari, F.] Publ Hlth Agcy Canada, Ctr Food Borne Environm & Zoonot Infect Dis, C EnterNet Surveillance, Guelph, ON, Canada; [Pintar, K.] Publ Hlth Agcy Canada, Lab Foodborne Zoonoses, C EnterNet surveillance, Guelph, ON, Canada",Universite de Montreal; Public Health Agency of Canada; Universite de Montreal; Public Health Agency of Canada; Public Health Agency of Canada,"David, JM (corresponding author), Publ Hlth Agcy Canada, Lab Foodborne Zoonoses, 3200 Rue Sicotte,CP5000, St Hyacinthe, PQ J2S 7C6, Canada.",julie.david@phac-aspc.gc.ca,,,,,,,,11,11,,,,,,,,,,,JAN,2014,142,1,,,,,28,39,,10.1017/S0950268813000770,http://dx.doi.org/10.1017/S0950268813000770,,,,,,,,,,,,2024-11-27,WOS:000332523900004,View Full Record in Web of Science
J,"Dalton, CB; Carlson, SJ; Butler, MT; Elvidge, E; Durrheim, DN",,,,"Dalton, Craig B.; Carlson, Sandra J.; Butler, Michelle T.; Elvidge, Elissa; Durrheim, David N.",,,"Building Influenza Surveillance Pyramids in Near Real Time, Australia",EMERGING INFECTIOUS DISEASES,,,,Article,,,,,,,,"A timely measure of circulating influenza virus severity has been elusive. Flutracking, the Australian online influenza-like illness surveillance system, was used to construct a surveillance pyramid in near real time for 2011/2012 participants and demonstrated a striking difference between years. Such pyramids will facilitate rapid estimation of attack rates and disease severity.","[Dalton, Craig B.; Carlson, Sandra J.; Butler, Michelle T.; Elvidge, Elissa; Durrheim, David N.] Hunter New England Populat Hlth, Newcastle, NSW, Australia; [Dalton, Craig B.; Durrheim, David N.] Newcastle Univ, Newcastle Upon Tyne NE1 7RU, Tyne & Wear, England",Newcastle University - UK,"Dalton, CB (corresponding author), Hunter New England Populat Hlth, Locked Bag 10, Wallsend, NSW 2287, Australia.",craig.dalton@hnehealth.nsw.gov.au,,,,,,,,11,14,,,,,,,,,,,NOV,2013,19,11,,,,,1863,1865,,10.3201/eid1911.121878,http://dx.doi.org/10.3201/eid1911.121878,,,,,,,,,,,,2024-11-27,WOS:000331061100024,View Full Record in Web of Science
J,"Wilking, H; Spitznagel, H; Werber, D; Lange, C; Jansen, A; Stark, K",,,,"Wilking, H.; Spitznagel, H.; Werber, D.; Lange, C.; Jansen, A.; Stark, K.",,,Acute gastrointestinal illness in adults in Germany: a population-based telephone survey,EPIDEMIOLOGY AND INFECTION,,,,Article,,,,,,,,"Population-based estimates of incidence and risk factors for acute gastrointestinal illness (AGI) are important for infectious disease surveillance and healthcare planning. We conducted a nationwide representative cross-sectional telephone survey of 21 262 adults over a 12-month period during 2008-2009 in Germany. Participants were asked if they had either AGI-related diarrhoea or vomiting in a 4-week recall period. We estimated 0.95 episodes/person per year (95% confidence interval 0.90-0.99), corresponding to 64.9 million episodes of AGI annually in adults, which results in 24.5 million outpatient visits, 19.9 million hospital days and 63.2 million days of work lost. We observed an overall declining trend of AGI with increasing age. Diarrhoea was more often reported than vomiting. The mean duration of illness was 3.8 days and did not differ between age groups. Social factors seemed to be weak predictors compared to state of health and health behaviour characteristics. This study allows international comparisons and contributes to the estimation of the global burden of AGI.","[Wilking, H.; Spitznagel, H.; Werber, D.; Jansen, A.; Stark, K.] Robert Koch Inst, Dept Infect Dis Epidemiol, D-13086 Berlin, Germany; [Lange, C.] Robert Koch Inst, Dept Epidemiol & Hlth Reporting, D-13086 Berlin, Germany; [Jansen, A.] European Ctr Dis Prevent & Control, Sci Advice Coordinat Sect, Stockholm, Sweden",Robert Koch Institute; Robert Koch Institute; European Centre for Disease Prevention & Control,"Wilking, H (corresponding author), Robert Koch Inst, Dept Infect Dis Epidemiol Gastrointestinal Infect, DGZ Ring 1, D-13086 Berlin, Germany.",WilkingH@rki.de,,,,,,,,34,38,,,,,,,,,,,NOV,2013,141,11,,,,,2365,2375,,10.1017/S0950268813000046,http://dx.doi.org/10.1017/S0950268813000046,,,,,,,,,,,,2024-11-27,WOS:000325222100014,View Full Record in Web of Science
J,"Halstead, FD; Lee, AV; Couto-Parada, X; Polley, SD; Ling, C; Jenkins, C; Chalmers, RM; Elwin, K; Gray, JJ; Iturriza-Gómara, M; Wain, J; Clark, DA; Bolton, FJ; Manuel, RJ",,,,"Halstead, Fenella D.; Lee, Adele V.; Couto-Parada, Xose; Polley, Spencer D.; Ling, Clare; Jenkins, Claire; Chalmers, Rachel M.; Elwin, Kristin; Gray, Jim J.; Iturriza-Gomara, Miren; Wain, John; Clark, Duncan A.; Bolton, Frederick J.; Manuel, Rohini J.",,Olympics GI Grp,Universal extraction method for gastrointestinal pathogens,JOURNAL OF MEDICAL MICROBIOLOGY,,,,Article,,,,,,,,"A universal stool extraction method for recovery of nucleic acids (NAs) from gastrointestinal pathogens was developed to support rapid diagnostics for the London 2012 Olympics. The method involved mechanical disruption (bead beating) of the stools, followed by automated extraction and detection using real-time PCR. This method had been used extensively in the Second Infectious Intestinal Disease Study (IID2) for the isolation of NA from bacteria and parasites (and was effective for the robust recovery of Cryptosporidium spp.) but had not been used for enteric viruses. To ensure this method was universally suitable, panels of samples known to contain target bacteria, viruses or parasites were processed in triplicate using the pre-treatment method routinely used for each target and the new extraction method (bead beating). The extracts were tested using real-time PCR and the cycle threshold values were compared. The results from this study showed that bead beating improved yields for the bacterial and parasitic targets and was suitable for the viral targets. The implementation of this universal method should confer cost- and time-saving benefits and streamline the processes required for the characterization of an array of pathogens from faecal samples.","[Halstead, Fenella D.] Royal Free London NHS Trust, London, England; [Halstead, Fenella D.; Jenkins, Claire; Gray, Jim J.; Iturriza-Gomara, Miren; Wain, John] PHE Microbiol Serv, London, England; [Lee, Adele V.; Couto-Parada, Xose; Ling, Clare; Clark, Duncan A.; Manuel, Rohini J.] Barts Hlth NHS Trust, PHE Publ Hlth Lab London, London, England; [Lee, Adele V.] Burnet Inst, Melbourne, Vic, Australia; [Polley, Spencer D.] Univ Coll London Hosp NHS Trust, London, England; [Chalmers, Rachel M.; Elwin, Kristin] Publ Hlth Wales Microbiol, Cryptosporidium Reference Lab, Swansea, W Glam, Wales; [Gray, Jim J.] Norfolk & Norwich Univ Hosp NHS Trust, Norfolk, VA USA; [Bolton, Frederick J.] PHE Publ Hlth Lab, Manchester, Lancs, England",University of London; University College London; Royal Free London NHS Foundation Trust; Barts Health NHS Trust; Burnet Institute; University of London; University College London; University College London Hospitals NHS Foundation Trust,"Halstead, FD (corresponding author), Royal Free London NHS Trust, London, England.",fenella_halstead@hotmail.co.uk,,,,,,,,20,21,,,,,,,,,,,OCT,2013,62,,10,,,,1535,1539,,10.1099/jmm.0.058743-0,http://dx.doi.org/10.1099/jmm.0.058743-0,,,,,,,,,,,,2024-11-27,WOS:000326212700006,View Full Record in Web of Science
