J,"Rose, TC; Adams, NL; Barr, B; Hawker, J; O'Brien, SJ; Violato, M; Whitehead, M; Taylor-Robinson, DC",,,,"Rose, Tanith C.; Adams, Natalie L.; Barr, Benjamin; Hawker, Jeremy; O'Brien, Sarah J.; Violato, Mara; Whitehead, Margaret; Taylor-Robinson, David C.",,,Socioeconomic status is associated with symptom severity and sickness absence in people with infectious intestinal disease in the UK,BMC INFECTIOUS DISEASES,,,,Article,,,,,,,,"Background: The burden of infectious intestinal disease (IID) in the UK is substantial. Negative consequences including sickness absence are common, but little is known about the social patterning of these outcomes, or the extent to which they relate to disease severity. Methods: We performed a cross-sectional analysis using IID cases identified from a large population-based survey, to explore the association between socioeconomic status (SES) and symptom severity and sickness absence; and to assess the role of symptom severity on the relationship between SES and absence. Regression modelling was used to investigate these associations, whilst controlling for potential confounders such as age, sex and ethnicity. Results: Among 1164 cases, those of lower SES versus high had twice the odds of experiencing severe symptoms (OR 2.2, 95% CI;1.66-2.87). Lower SES was associated with higher odds of sickness absence (OR 1.8, 95% CI;1.26-2.69), however this association was attenuated after adjusting for symptom severity (OR 1.4, 95% CI; 0.92-2.07). Conclusions: In a large sample of IID cases, those of low SES versus high were more likely to report severe symptoms, and sickness absence; with greater severity largely explaining the higher absence. Public health interventions are needed to address the unequal consequences of IID identified.","[Rose, Tanith C.; Adams, Natalie L.; Barr, Benjamin; Hawker, Jeremy; O'Brien, Sarah J.; Violato, Mara; Whitehead, Margaret; Taylor-Robinson, David C.] NIHR Hlth Protect Res Unit Gastrointestinal Infec, Liverpool, Merseyside, England; [Rose, Tanith C.; Adams, Natalie L.; Barr, Benjamin; O'Brien, Sarah J.; Whitehead, Margaret; Taylor-Robinson, David C.] Univ Liverpool, Dept Publ Hlth & Policy, Liverpool, Merseyside, England; [Adams, Natalie L.; Hawker, Jeremy] Publ Hlth England, Natl Infect Serv, London, England; [Violato, Mara] Univ Oxford, Hlth Econ Res Ctr, Oxford, England; [Rose, Tanith C.] Univ Liverpool, Dept Publ Hlth, Whelan Bldg, Liverpool L69 3GB, Merseyside, England; [Rose, Tanith C.] Univ Liverpool, Policy Inst Psychol Hlth & Soc, Whelan Bldg, Liverpool L69 3GB, Merseyside, England",University of Liverpool; Public Health England; University of Oxford; University of Liverpool; University of Liverpool,"Rose, TC (corresponding author), NIHR Hlth Protect Res Unit Gastrointestinal Infec, Liverpool, Merseyside, England.;Rose, TC (corresponding author), Univ Liverpool, Dept Publ Hlth & Policy, Liverpool, Merseyside, England.",Tanith.Rose@liverpool.ac.uk,,,,,,,,14,16,,,,,,,,,,,JUN 23,2017,17,,,,,,,,447,10.1186/s12879-017-2551-1,http://dx.doi.org/10.1186/s12879-017-2551-1,,,,,,,,,,,,2024-11-27,WOS:000404337500005,View Full Record in Web of Science
J,"Harris, JP; Iturriza-Gomara, M; O'Brien, SJ",,,,"Harris, John P.; Iturriza-Gomara, Miren; O'Brien, Sarah J.",,,Re-assessing the total burden of norovirus circulating in the United Kingdom population,VACCINE,,,,Article,,,,,,,,"The second Infectious Intestinal Diseases study (IID2) estimated the incidence of norovirus in the UK at 47/1000 population (three million cases annually). Clinically significant norovirus was defined using a cycle threshold (ct) value of <30; a more stringent cut-off than used in diagnostic laboratories. The low infectious dose of norovirus means asymptomatic individuals potentially contribute to ongoing transmission. Using a less stringent but diagnostically relevant threshold increases the estimation of the population burden of norovirus infection by around 26% to 59/1000 person years (95% CI 52.32-64.98), equating to 3.7 million norovirus infections annually (3.3-4.1 million). With possible vaccines on the horizon for norovirus, having a good estimate of the total burden of norovirus infection, as well as symptomatic disease will be useful in helping to guide vaccination policy when candidate vaccines become available. (C) 2017 The Author(s). Published by Elsevier Ltd.","[Harris, John P.; Iturriza-Gomara, Miren; O'Brien, Sarah J.] Univ Liverpool, NIHR HPRU, Gastrointestinal Infect, Liverpool, Merseyside, England",University of Liverpool,"Harris, JP (corresponding author), Univ Liverpool, Farr Inst HeRC, 2nd Floor,Block F,Waterhouse Buildings, Liverpool L69 3GL, Merseyside, England.",john.harris@liverpool.ac.uk,,,,,,,,15,17,,,,,,,,,,,FEB 7,2017,35,6,,,,,853,855,,10.1016/j.vaccine.2017.01.009,http://dx.doi.org/10.1016/j.vaccine.2017.01.009,,,,,,,,,,,,2024-11-27,WOS:000394196000002,View Full Record in Web of Science
J,"Moss, R; Zarebski, A; Dawson, P; McCaw, JM",,,,"Moss, R.; Zarebski, A.; Dawson, P.; McCaw, J. M.",,,Retrospective forecasting of the 2010-2014 Melbourne influenza seasons using multiple surveillance systems,EPIDEMIOLOGY AND INFECTION,,,,Article,,,,,,,,"Accurate forecasting of seasonal influenza epidemics is of great concern to healthcare providers in temperate climates, since these epidemics vary substantially in their size, timing and duration from year to year, making it a challenge to deliver timely and proportionate responses. Previous studies have shown that Bayesian estimation techniques can accurately predict when an influenza epidemic will peak many weeks in advance, and we have previously tailored these methods for metropolitan Melbourne (Australia) and Google Flu Trends data. Here we extend these methods to clinical observation and laboratory-confirmation data for Melbourne, on the grounds that these data sources provide more accurate characterizations of influenza activity. We show that from each of these data sources we can accurately predict the timing of the epidemic peak 4-6 weeks in advance. We also show that making simultaneous use of multiple surveillance systems to improve forecast skill remains a fundamental challenge. Disparate systems provide complementary characterizations of disease activity, which may or may not be comparable, and it is unclear how a ground truth' for evaluating forecasts against these multiple characterizations might be defined. These findings are a significant step towards making optimal use of routine surveillance data for outbreak forecasting.","[Moss, R.; McCaw, J. M.] Univ Melbourne, Melbourne Sch Populat & Global Hlth, Ctr Epidemiol & Biostat, Melbourne, Vic, Australia; [Zarebski, A.; McCaw, J. M.] Univ Melbourne, Sch Math & Stat, Melbourne, Vic, Australia; [Dawson, P.] Def Sci & Technol Grp, Land Personnel Protect Branch, Land Div, Melbourne, Vic, Australia; [McCaw, J. M.] Royal Childrens Hosp, Murdoch Childrens Res Inst, Modelling & Simulat, Melbourne, Vic, Australia",University of Melbourne; University of Melbourne; Defence Science & Technology; Royal Children's Hospital Melbourne; Murdoch Children's Research Institute,"Moss, R (corresponding author), Univ Melbourne, Level 3,207 Bouverie St, Melbourne, Vic 3010, Australia.",rgmoss@unimelb.edu.au,,,,,,,,20,21,,,,,,,,,,,JAN,2017,145,1,,,,,156,169,,10.1017/S0950268816002053,http://dx.doi.org/10.1017/S0950268816002053,,,,,,,,,,,,2024-11-27,WOS:000390101500018,View Full Record in Web of Science
J,"van Rensburg, MJJ; Swift, C; Cody, AJ; Jenkins, C; Maiden, MCJ",,,,"van Rensburg, Melissa J. Jansen; Swift, Craig; Cody, Alison J.; Jenkins, Claire; Maiden, Martin C. J.",,,Exploiting Bacterial Whole-Genome Sequencing Data for Evaluation of Diagnostic Assays: Campylobacter Species Identification as a Case Study,JOURNAL OF CLINICAL MICROBIOLOGY,,,,Article,,,,,,,,"The application of whole-genome sequencing (WGS) to problems in clinical microbiology has had a major impact on the field. Clinical laboratories are now using WGS for pathogen identification, antimicrobial susceptibility testing, and epidemiological typing. WGS data also represent a valuable resource for the development and evaluation of molecular diagnostic assays, which continue to play an important role in clinical microbiology. To demonstrate this application of WGS, this study used publicly available genomic data to evaluate a duplex real-time PCR (RT-PCR) assay that targets mapA and ceuE for the detection of Campylobacter jejuni and Campylobacter coli, leading global causes of bacterial gastroenteritis. In silico analyses of mapA and ceuE primer and probe sequences from 1,713 genetically diverse C. jejuni and C. coli genomes, supported by RT-PCR testing, indicated that the assay was robust, with 1,707 (99.7%) isolates correctly identified. The high specificity of the mapA-ceuE assay was the result of interspecies diversity and intraspecies conservation of the target genes in C. jejuni and C. coli. Rare instances of a lack of specificity among C. coli isolates were due to introgression in mapA or sequence diversity in ceuE. The results of this study illustrate how WGS can be exploited to evaluate molecular diagnostic assays by using publicly available data, online databases, and open-source software.","[van Rensburg, Melissa J. Jansen; Cody, Alison J.; Maiden, Martin C. J.] Univ Oxford, Dept Zool, Oxford, England; [van Rensburg, Melissa J. Jansen; Swift, Craig; Cody, Alison J.; Jenkins, Claire; Maiden, Martin C. J.] Univ Oxford, NIHR Hlth Protect Res Unit Gastrointestinal Infec, Oxford, England; [Swift, Craig; Jenkins, Claire] Publ Hlth England, Gastrointestinal Bacteria Reference Unit, London, England",University of Oxford; University of Oxford; Public Health England,"Maiden, MCJ (corresponding author), Univ Oxford, Dept Zool, Oxford, England.;Maiden, MCJ (corresponding author), Univ Oxford, NIHR Hlth Protect Res Unit Gastrointestinal Infec, Oxford, England.",martin.maiden@zoo.ox.ac.uk,,,,,,,,12,13,,,,,,,,,,,DEC,2016,54,12,,,,,2882,2890,,10.1128/JCM.01522-16,http://dx.doi.org/10.1128/JCM.01522-16,,,,,,,,,,,,2024-11-27,WOS:000389209600008,View Full Record in Web of Science
J,"Allen, DJ; Trainor, E; Callaghan, A; O'Brien, SJ; Cunliffe, NA; Iturriza-Gómara, M",,,,"Allen, David J.; Trainor, Eamonn; Callaghan, Anna; O'Brien, Sarah J.; Cunliffe, Nigel A.; Iturriza-Gomara, Miren",,,Early Detection of Epidemic GII-4 Norovirus Strains in UK and Malawi: Role of Surveillance of Sporadic Acute Gastroenteritis in Anticipating Global Epidemics,PLOS ONE,,,,Article,,,,,,,,"Noroviruses are endemic in the human population, and are recognised as a leading cause of acute gastroenteritis worldwide. Although they are a highly diverse group of viruses, genogroup-II genotype-4 (GII-4) noroviruses are the most frequently identified strains worldwide. The predominance of GII-4 norovirus strains is driven by the periodic emergence of antigenic variants capable of evading herd protection. The global molecular epidemiology of emerging GII-4 strains is largely based on data from outbreak surveillance programmes, but the epidemiology of GII-4 strains among sporadic or community cases is far less well studied. To understand the distribution of GII-4 norovirus strains associated with gastroenteritis in the wider population, we characterised the GII-4 norovirus strains detected during studies of sporadic cases of infectious gastroenteritis collected in the UK and Malawi between 1993 and 2009. Our data shows that GII-4 norovirus strains that have emerged as strains of global epidemic importance have circulated in the community up to 18 years before their recognition as pandemic strains associated with increases in outbreaks. These data may suggest that more comprehensive surveillance programmes that incorporate strains associated with sporadic cases may provide a way for early detection of emerging strains with pandemic potential. This may be of particular relevance as vaccines become available.","[Allen, David J.; Callaghan, Anna] Publ Hlth England, Virus Reference Dept, London, England; [Trainor, Eamonn; Cunliffe, Nigel A.; Iturriza-Gomara, Miren] Univ Liverpool, Inst Infect & Global Hlth, Dept Clin Infect Microbiol & Immunol, Liverpool L69 3BX, Merseyside, England; [Callaghan, Anna] London Sch Hyg & Trop Med, Pathogen Mol Biol Unit, London WC1, England; [O'Brien, Sarah J.] Univ Liverpool, Dept Epidemiol & Publ Hlth, Inst Infect & Global Hlth, Liverpool L69 3BX, Merseyside, England; [Allen, David J.; O'Brien, Sarah J.; Iturriza-Gomara, Miren] Univ Liverpool, NIHR Hlth Protect Res Unit Gastrointestinal Infec, Liverpool L69 3BX, Merseyside, England; [Trainor, Eamonn] St Helens & Knowsley Teaching Hosp NHS Trust, Liverpool, Merseyside, England",Public Health England; University of Liverpool; University of London; London School of Hygiene & Tropical Medicine; University of Liverpool; University of Liverpool,"Iturriza-Gomara, M (corresponding author), Univ Liverpool, Inst Infect & Global Hlth, Dept Clin Infect Microbiol & Immunol, Liverpool L69 3BX, Merseyside, England.;Iturriza-Gomara, M (corresponding author), Univ Liverpool, NIHR Hlth Protect Res Unit Gastrointestinal Infec, Liverpool L69 3BX, Merseyside, England.",M.Iturriza-Gomara@liverpool.ac.uk,,,,,,,,21,27,,,,,,,,,,,APR 26,2016,11,4,,,,,,,e0146972,10.1371/journal.pone.0146972,http://dx.doi.org/10.1371/journal.pone.0146972,,,,,,,,,,,,2024-11-27,WOS:000374973600006,View Full Record in Web of Science
J,"O'Brien, SJ; Donaldson, AL; Iturriza-Gomara, M; Tam, CC",,,,"O'Brien, Sarah J.; Donaldson, Anna L.; Iturriza-Gomara, Miren; Tam, Clarence C.",,,Age-Specific Incidence Rates for Norovirus in the Community and Presenting to Primary Healthcare Facilities in the United Kingdom,JOURNAL OF INFECTIOUS DISEASES,,,,Article,,,,,,,,"In a prospective, population-based cohort study and a study of primary-healthcare consultations, we had a rare opportunity to estimate age-specific rates of norovirus-associated infectious intestinal disease in the United Kingdom. Rates in children aged <5 years were significantly higher than those for other age groups in the community ( 142.6 cases per 1000 person-years [95% confidence interval {CI}, 99.8-203.9] vs 37.6 [95% CI, 31.5-44.7]) and those for individuals presenting to primary healthcare (14.4 cases per 1000 person-years [95% CI, 8.5-24.5] vs 1.4 [95% CI,.9-2.0]). Robust incidence estimates are crucial for vaccination policy makers. This study emphasises the impact of norovirus-associated infectious intestinal disease, especially in children aged <5 years.","[O'Brien, Sarah J.; Donaldson, Anna L.; Iturriza-Gomara, Miren] Univ Liverpool, NIHR Hlth Protect Res Unit Gastrointestinal Infec, Liverpool L69 3BX, Merseyside, England; [O'Brien, Sarah J.; Donaldson, Anna L.] Univ Liverpool, Inst Infect & Global Hlth, Epidemiol & Populat Hlth, Liverpool L69 3BX, Merseyside, England; [Iturriza-Gomara, Miren] Univ Liverpool, Inst Infect & Global Hlth, Clin Infect Microbiol & Immunol, Liverpool L69 3BX, Merseyside, England; [O'Brien, Sarah J.] Farr Inst HeRC, Liverpool, Merseyside, England; [Tam, Clarence C.] Natl Univ Singapore, Saw Swee Hock Sch Publ Hlth, Singapore 117548, Singapore",University of Liverpool; University of Liverpool; University of Liverpool; National University of Singapore,"O'Brien, SJ (corresponding author), Univ Liverpool, NIHR Hlth Protect Res Unit Gastrointestinal Infec, Liverpool L69 3BX, Merseyside, England.;O'Brien, SJ (corresponding author), Univ Liverpool, Inst Infect & Global Hlth, Epidemiol & Populat Hlth, Liverpool L69 3BX, Merseyside, England.;O'Brien, SJ (corresponding author), Farr Inst HeRC, Liverpool, Merseyside, England.;O'Brien, SJ (corresponding author), NIHR Hlth Protect Res Unit Gastrointestinal Infec, 2nd Floor,Block F,Waterhouse Bldg,1-5 Brownlow St, Liverpool L69 3GL, Merseyside, England.",s.j.obrien@liverpool.ac.uk,,,,,,,,31,35,,,,,,,,,,,FEB 1,2016,213,,,1,,,S15,S18,,10.1093/infdis/jiv411,http://dx.doi.org/10.1093/infdis/jiv411,,,,,,,,,,,,2024-11-27,WOS:000370300800005,View Full Record in Web of Science
J,"Viviani, L; van der Es, M; Irvine, L; Tam, CC; Rodrigues, LC; Jackson, KA; O'Brien, SJ; Hunter, PR",,,,"Viviani, Laura; van der Es, Mike; Irvine, Lisa; Tam, Clarence C.; Rodrigues, Laura C.; Jackson, Kathryn A.; O'Brien, Sarah J.; Hunter, Paul R.",,IID2 Study Executive Comm,Estimating the Incidence of Acute Infectious Intestinal Disease in the Community in the UK: A Retrospective Telephone Survey,PLOS ONE,,,,Article,,,,,,,,"Objectives To estimate the burden of intestinal infectious disease (IID) in the UK and determine whether disease burden estimations using a retrospective study design differ from those using a prospective study design. Design/Setting A retrospective telephone survey undertaken in each of the four countries comprising the United Kingdom. Participants were randomly asked about illness either in the past 7 or 28 days. Participants 14,813 individuals for all of whom we had a legible recording of their agreement to participate Outcomes Self-reported IID, defined as loose stools or clinically significant vomiting lasting less than two weeks, in the absence of a known non-infectious cause. Results The rate of self-reported IID varied substantially depending on whether asked for illness in the previous 7 or 28 days. After standardising for age and sex, and adjusting for the number of interviews completed each month and the relative size of each UK country, the estimated rate of IID in the 7-day recall group was 1,530 cases per 1,000 person-years (95% CI: 1135-2113), while in the 28-day recall group it was 533 cases per 1,000 person-years (95% CI: 377-778). There was no significant variation in rates between the four countries. Rates in this study were also higher than in a related prospective study undertaken at the same time. Conclusions The estimated burden of disease from IID varied dramatically depending on study design. Retrospective studies of IID give higher estimates of disease burden than prospective studies. Of retrospective studies longer recall periods give lower estimated rates than studies with short recall periods. Caution needs to be exercised when comparing studies of self-reported IID as small changes in study design or case definition can markedly affect estimated rates.","[Viviani, Laura; Tam, Clarence C.; Rodrigues, Laura C.] London Sch Hyg & Trop Med, Dept Infect Dis Epidemiol, London WC1, England; [van der Es, Mike; Irvine, Lisa; Hunter, Paul R.] Univ E Anglia, Norwich Sch Med, Norwich NR4 7TJ, Norfolk, England; [Jackson, Kathryn A.; O'Brien, Sarah J.] Univ Liverpool, Inst Infect & Global Hlth, Liverpool L69 3BX, Merseyside, England",University of London; London School of Hygiene & Tropical Medicine; University of East Anglia; University of Liverpool,"Hunter, PR (corresponding author), Univ E Anglia, Norwich Sch Med, Norwich NR4 7TJ, Norfolk, England.",Paul.Hunter@uea.ac.uk,,,,,,,,9,12,,,,,,,,,,,JAN 25,2016,11,1,,,,,,,e0146171,10.1371/journal.pone.0146171,http://dx.doi.org/10.1371/journal.pone.0146171,,,,,,,,,,,,2024-11-27,WOS:000369527800017,View Full Record in Web of Science
J,"Atchison, CJ; Stowe, J; Andrews, N; Collins, S; Allen, DJ; Nawaz, S; Brown, D; Ramsay, ME; Ladhani, SN",,,,"Atchison, Christina J.; Stowe, Julia; Andrews, Nick; Collins, Sarah; Allen, David J.; Nawaz, Sameena; Brown, David; Ramsay, Mary E.; Ladhani, Shamez N.",,,Rapid Declines in Age Group-Specific Rotavirus Infection and Acute Gastroenteritis Among Vaccinated and Unvaccinated Individuals Within 1 Year of Rotavirus Vaccine Introduction in England and Wales,JOURNAL OF INFECTIOUS DISEASES,,,,Article,,,,,,,,"Background. The oral infant rotavirus vaccine, Rotarix, was introduced in England and Wales in July 2013. We estimated the impact on laboratory-confirmed rotavirus infections and hospitalizations for all-cause acute gastroenteritis (AGE) during the first year after introduction. Methods. We extracted data on laboratory-confirmed rotavirus infections (July 2000 through June 2015) and all-cause AGE-associated hospitalizations (July 2007 through June 2014) for all age groups using national databases (LabBase2 and HES). We determined the ratio of the rate during the 2013-2014 rotavirus season to the rate during the prevaccination era. Results. In infants, there was a 77% decline (rate ratio [RR], 0.23; 95% confidence interval [CI], .16-.32) in laboratory-confirmed rotavirus infections and a 26% decline (RR, 0.74; 95% CI, .65-.84) in all-cause AGE-associated hospitalizations in 2013-2014, compared with the prevaccination era. Large reductions were also observed in older children, adults, and older adults. We estimated that 10 884 laboratory-confirmed infections and 50 427 all-cause AGE-associated hospital admissions were averted in 2013-2014. Similar reductions have been observed for laboratory-confirmed rotavirus infections during the 2014-2015 season. Conclusions. The rapid declines in rotavirus infection and AGE in vaccinated and unvaccinated age groups within 1 year of introducing an infant rotavirus vaccination program are far greater than expected and than previously reported by other countries.","[Atchison, Christina J.; Stowe, Julia; Andrews, Nick; Collins, Sarah; Ramsay, Mary E.; Ladhani, Shamez N.] Univ London Imperial Coll Sci Technol & Med, Immunisat Hepatitis & Blood Safety Dept, London, England; [Allen, David J.; Nawaz, Sameena; Brown, David] Univ London Imperial Coll Sci Technol & Med, Publ Hlth England, Ctr Infect Dis Surveillance & Control, Virus Reference Dept, London, England; [Atchison, Christina J.] Univ London Imperial Coll Sci Technol & Med, Dept Primary Care & Publ Hlth, London, England",Imperial College London; Public Health England; Imperial College London; Imperial College London,"Ladhani, SN (corresponding author), Publ Hlth England, Ctr Infect Dis Surveillance & Control, Immunisat Hepatitis & Blood Safety Dept, 61 Colindale Ave, London NW9 5EQ, England.",Shamez.Ladhani@phe.gov.uk,,,,,,,,69,75,,,,,,,,,,,JAN 15,2016,213,2,,,,,243,249,,10.1093/infdis/jiv398,http://dx.doi.org/10.1093/infdis/jiv398,,,,,,,,,,,,2024-11-27,WOS:000371237900011,View Full Record in Web of Science
