J,"Chattaway, MA; Harris, R; Jenkins, C; Tam, C; Coia, JE; Gray, J; Iturriza-Gomara, M; Wain, J",,,,"Chattaway, M. A.; Harris, R.; Jenkins, C.; Tam, C.; Coia, J. E.; Gray, J.; Iturriza-Gomara, M.; Wain, J.",,,"Investigating the link between the presence of enteroaggregative Escherichia coli and infectious intestinal disease in the United Kingdom, 1993 to 1996 and 2008 to 2009",EUROSURVEILLANCE,,,,Article,,,,,,,,"There are an estimated 17 million human diarrhoea cases annually in the United Kingdom. In 2008 and 2009, enteroaggregative E. coli (EAEC) were identified in 1.9% of stools. However, it remains unclear whether there is a causal link between presence of EAEC and disease. This study used bacterial load, the presence of co-infections and demographic data to assess if EAEC was independently associated with intestinal infectious disease. Quantitative real-time PCR data (Ct values) generated directly from stool specimens for several pathogen targets were analysed to identify multiple pathogens, including EAEC, in the stools of cases and healthy controls. Sensitivity and specificity using Ct value (60% and 60%) was not useful for identifying cases or controls, but an independent association between disease and EAEC presence was demonstrated: multivariate logistic regression for EAEC presence (odds ratio: 2.41; 95% confidence interval: 1.78-3.26; p<0.001). The population-attributable fraction was 3.3%. The group of bacteria known as EAEC are associated with gastrointestinal disease in at least half of the cases with EAEC positive stools. We conclude that the current definition of EAEC, by plasmid gene detection, includes true pathogens as well as non-pathogenic variants.","[Chattaway, M. A.; Jenkins, C.; Wain, J.] Publ Hlth England, Gastrointestinal Bacteria Reference Unit, London, England; [Tam, C.] London Sch Hyg & Trop Med, Dept Infect Dis Epidemiol, London, England; [Coia, J. E.] Scottish Salmonella Shigella & Clostridium Diffic, Glasgow, Lanark, Scotland; [Gray, J.; Wain, J.] Univ E Anglia, Norwich & Norfolk Univ Hosp, Norwich NR4 7TJ, Norfolk, England; [Gray, J.; Wain, J.] Univ E Anglia, Norwich Med Sch, Norwich NR4 7TJ, Norfolk, England; [Iturriza-Gomara, M.] Univ Liverpool, Liverpool L69 3BX, Merseyside, England",Public Health England; University of London; London School of Hygiene & Tropical Medicine; University of East Anglia; University of East Anglia; University of Liverpool,"Chattaway, MA (corresponding author), Publ Hlth England, Gastrointestinal Bacteria Reference Unit, London, England.",J.Wain@uea.ac.uk,,,,,,,,4,4,,,,,,,,,,,SEP 12,2013,18,37,,,,,20,26,,,,,,,,,,,,,,,2024-11-27,WOS:000324615300003,View Full Record in Web of Science
J,"Tam, CC; Viviani, L; Rodrigues, LC; O'Brien, SJ",,,,"Tam, Clarence C.; Viviani, Laura; Rodrigues, Laura C.; O'Brien, Sarah J.",,,The second study of infectious intestinal disease (IID2): increased rates of recurrent diarrhoea in individuals aged 65 years and above,BMC PUBLIC HEALTH,,,,Article,,,,,,,,"Background: Infectious intestinal disease (IID) is a major health and economic burden in high-income countries. In the UK, there are an estimated 17 million IID cases annually, of which 6 million are caused by the 12 most common pathogens. Host factors that influence risk of IID are not well understood. Methods: We analyzed data from the IID2 Study, a UK cohort that measured IID incidence, to investigate factors associated with recurrent IID. We calculated rates of IID by age group, sex, previous episodes experienced, and socioecomic indicators. We used Cox models to investigate factors associated with recurrent illness. Results: The rate of IID was five times higher among infants than those aged 65 years and above (hazard ratio, HR = 5.0, 95% CI: 3.1 - 8.0). However, the association between previous IID and a subsequent IID episode was stronger in the elderly. Among those aged 65 years and above, each additional IID episode increased the rate of subsequent IID three-fold (HR = 3.1, 95% CI: 2.5 - 3.7). Among infants, the corresponding increase was 1.7-fold (HR = 1.7, 95% CI: 1.3 - 2.3). Conclusions: Elderly populations have a high propensity for recurrent IID. More detailed studies are needed to identify vulnerable subgroups and susceptibility factors, and inform adequate control policies among the elderly.","[Tam, Clarence C.; Viviani, Laura; Rodrigues, Laura C.] Univ London London Sch Hyg & Trop Med, Dept Infect Dis Epidemiol, London WC1E 7HT, England; [Tam, Clarence C.] Natl Univ Singapore, Saw Swee Hock Sch Publ Hlth, Singapore 117548, Singapore",University of London; London School of Hygiene & Tropical Medicine; National University of Singapore,"Tam, CC (corresponding author), Univ London London Sch Hyg & Trop Med, Dept Infect Dis Epidemiol, Keppel St, London WC1E 7HT, England.",clarence.tam@lshtm.ac.uk,,,,,,,,10,11,,,,,,,,,,,AUG 9,2013,13,,,,,,,,739,10.1186/1471-2458-13-739,http://dx.doi.org/10.1186/1471-2458-13-739,,,,,,,,,,,,2024-11-27,WOS:000323006300001,View Full Record in Web of Science
J,"Risebro, HL; Breton, L; Aird, H; Hooper, A; Hunter, PR",,,,"Risebro, Helen L.; Breton, Lynette; Aird, Heather; Hooper, Alan; Hunter, Paul R.",,,Contaminated Small Drinking Water Supplies and Risk of Infectious Intestinal Disease: A Prospective Cohort Study,PLOS ONE,,,,Article,,,,,,,,"Background: This study sought to identify whether elevated risk of infectious intestinal disease (IID) exists in contaminated small water supply consumers compared with consumers drinking from small supplies complying with current standards and whether this effect is modified by age. Methodology and Principal Findings: A prospective cohort study of 611 individuals receiving small supplies in England was conducted. Water supplies received sanitary inspection and examination for indicator bacteria and participants maintained a daily record of IID. Regression modeling with generalized estimating equations that included interaction terms between age and indicators of fecal pollution was performed. Crude IID prevalence was 9.3 days with symptoms/1000 person days (95% CI: 8.4, 10.1) and incidence was 3.2 episodes/1000 person days (95% CI, 2.7, 3.7) or 1.2 episodes per person year. Although there was no overall association between IID risk and indicator presence, there was strong interaction between age and indicator presence. In children under ten, relative risk (RR) of IID in those drinking from enterococci contaminated supplies was 4.8 (95% CI: 1.5, 15.3) for incidence and 8.9 (95% CI: 2.8, 27.5) for prevalence. In those aged 10 to 59, IID risk was lower but not statistically significant. Conclusions: Contaminated small water supplies pose a substantial risk of IID to young children who live in homes reliant on these supplies. By contrast older children and adults do not appear to be at increased risk. Health care professionals with responsibility for children living in homes provided by very small water supplies should make parents aware of the risk.","[Risebro, Helen L.; Breton, Lynette; Hunter, Paul R.] Univ E Anglia, Norwich Med Sch, Norwich NR4 7TJ, Norfolk, England; [Aird, Heather] Norfolk & Norwich Univ Hosp NHS Trust, Food Water & Environm Lab, Norwich, Norfolk, England; [Hooper, Alan] Hereford Cty Hosp, Dept Microbiol & Immunol, Hereford, England",University of East Anglia; Norfolk & Norwich University Hospitals NHS Foundation Trust,"Risebro, HL (corresponding author), Univ E Anglia, Norwich Med Sch, Norwich NR4 7TJ, Norfolk, England.",Paul.Hunter@uea.ac.uk,,,,,,,,18,20,,,,,,,,,,,AUG 24,2012,7,8,,,,,,,e42762,10.1371/journal.pone.0042762,http://dx.doi.org/10.1371/journal.pone.0042762,,,,,,,,,,,,2024-11-27,WOS:000308225500015,View Full Record in Web of Science
J,"Baumann-Popczyk, A; Sadkowska-Todys, M; Rogalska, J; Stefanoff, P",,,,"Baumann-Popczyk, A.; Sadkowska-Todys, M.; Rogalska, J.; Stefanoff, P.",,,Incidence of self-reported acute gastrointestinal infections in the community in Poland: a population-based study,EPIDEMIOLOGY AND INFECTION,,,,Article,,,,,,,,"A retrospective cross-sectional survey of self-reported acute gastrointestinal infection (AGI) incidence in the community was performed in Poland, from December 2008 to November 2009. The aim of the study was to estimate the magnitude and distribution of self-reported AGI, in order to calibrate the routine AGI surveillance system in Poland. The study population were randomly selected residents of all Polish regions, having a fixed telephone line. An equal number of telephone interviews were collected each month, requesting the interviewee to identify gastrointestinal symptoms that had occurred in the previous 4 weeks. The international AGI case definition was used. In total 3583 complete interviews were obtained. The compliance ratio was 26%. Of 3583 respondents, 240 (6.7%) individuals fulfilled the AGI case definition. The annualized incidence of acute gastroenteritis was 0.9/person-year (95% confidence interval 0.8-1.0). Comparison of the obtained annual AGI estimate (33.3 million infections) with the number of cases reported to national surveillance during the corresponding period (73 512), yielded an underreporting factor of 453 cases occurring in the community for each reported case. Of the 240 AGI cases, 30.4% consulted a general practitioner, and 4.6% were admitted to hospital. Samples for microbiological confirmation were collected from four (1.6%) cases. This first population-based study in eastern Europe has confirmed that AGI places a high burden on Polish society, which is underestimated by national surveillance data. Efforts are necessary to improve AGI reporting and diagnostic practices in order to increase the effectiveness of the Polish surveillance system in detecting threats related to new AGI pathogens, new routes of transmission or the potential for international spread.","[Baumann-Popczyk, A.; Sadkowska-Todys, M.; Rogalska, J.; Stefanoff, P.] Natl Inst Publ Hlth, Dept Epidemiol, Natl Inst Hyg, PL-00791 Warsaw, Poland",National Institute of Public Health (NIPH); National Institute of Hygiene (NIH),"Stefanoff, P (corresponding author), Natl Inst Publ Hlth, Dept Epidemiol, Natl Inst Hyg, 24 Chocimska Str, PL-00791 Warsaw, Poland.",pstefanoff@pzh.gov.pl,,,,,,,,24,26,,,,,,,,,,,JUL,2012,140,7,,,,,1173,1184,,10.1017/S0950268811001853,http://dx.doi.org/10.1017/S0950268811001853,,,,,,,,,,,,2024-11-27,WOS:000304013100003,View Full Record in Web of Science
J,"Scavia, G; Baldinelli, F; Busani, L; Caprioli, A",,,,"Scavia, G.; Baldinelli, F.; Busani, L.; Caprioli, A.",,,"The burden of self-reported acute gastrointestinal illness in Italy: a retrospective survey, 2008-2009",EPIDEMIOLOGY AND INFECTION,,,,Article,,,,,,,,"A retrospective telephone survey (n=3490) was conducted in Italy between 2008 and 2009 to estimate the occurrence of self-reported acute gastrointestinal illness (AGI) and to describe subjects' recourse to healthcare, using a symptom-based case definition. Three hundred and ten AGI cases were identified. The annual incidence rate was 1.08 episodes/person-year (95% confidence interval 0.90-1.14). The proportion of subjects consulting physicians was 39.5% while only 0.3% submitted a specimen for laboratory investigation. Risk factors for AGI and medical care-seeking were identified using logistic regression analysis. Females, children and young adults had a significantly higher incidence rate of AGI. Factors associated with medical care-seeking were age < 10 years, presence of fever, diarrhoea, and duration of illness > 3 days. Our results provide a relevant contribution towards estimating the global burden of AGI using standard methods that ensure a good level of comparability with other studies.","[Scavia, G.; Baldinelli, F.; Busani, L.; Caprioli, A.] Ist Super Sanita, I-00161 Rome, Italy; [Busani, L.] Ist Zooprofilattico Sperimentale Venezie, Padua, Italy",Istituto Superiore di Sanita (ISS); IZS delle Venezie,"Scavia, G (corresponding author), Ist Super Sanita, Viale Regina Elena 299, I-00161 Rome, Italy.",gaia.scavia@iss.it,,,,,,,,38,43,,,,,,,,,,,JUL,2012,140,7,,,,,1193,1206,,10.1017/S0950268811002020,http://dx.doi.org/10.1017/S0950268811002020,,,,,,,,,,,,2024-11-27,WOS:000304013100005,View Full Record in Web of Science
J,"Tam, CC; O'Brien, SJ; Tompkins, DS; Bolton, FJ; Berry, L; Dodds, J; Choudhury, D; Halstead, F; Iturriza-Gómara, M; Mather, K; Rait, G; Ridge, A; Rodrigues, LC; Wain, J; Wood, B; Gray, JJ",,,,"Tam, Clarence C.; O'Brien, Sarah J.; Tompkins, David S.; Bolton, Frederick J.; Berry, Lisa; Dodds, Julie; Choudhury, Dalia; Halstead, Fenella; Iturriza-Gomara, Miren; Mather, Katherine; Rait, Greta; Ridge, Alan; Rodrigues, Laura C.; Wain, John; Wood, Bernard; Gray, James J.",,IID2 Study Executive Comm,"Changes in Causes of Acute Gastroenteritis in the United Kingdom Over 15 Years: Microbiologic Findings From 2 Prospective, Population-Based Studies of Infectious Intestinal Disease",CLINICAL INFECTIOUS DISEASES,,,,Article,,,,,,,,"Background. Large-scale, prospective studies of infectious intestinal disease (IID) in developed countries are uncommon. Two studies of IID incidence and etiology have been conducted in the United Kingdom: the Infectious Intestinal Disease Study in England (IID1) in 1993-1996 and the Second Study of Infectious Intestinal Disease in the Community (IID2) in 2008-2009. We examined changes in etiology and diagnostic yield of IID cases over 15 years. Methods. Fecal samples submitted by IID cases were examined for a range of bacterial, viral, and protozoal pathogens using traditional and molecular microbiological methods. We calculated the percentage of specimens positive for each organism based on traditional methods and on traditional and molecular methods combined. We compared the distributions of organisms in the 2 studies. Results. For pathogens investigated in both studies, 40% of fecal samples submitted by cases in IID2 were positive compared with 28% in IID1. Viruses were most frequent among community cases in IID2. Campylobacter was the most common bacterial pathogen among cases presenting to healthcare. Major differences between the 2 studies were increases in the detection of norovirus and sapovirus and a decline Salmonella. Conclusions. Most fecal specimens were negative for the pathogens tested in both studies, so new strategies are needed to close the diagnostic gap. Among known pathogens, effective control of norovirus, rotavirus, and Campylobacter remain high priorities. The reduction in nontyphoidal salmonellosis demonstrates the success of Europe-wide control strategies, notably an industry-led Salmonella control program in poultry in the United Kingdom.","[Tam, Clarence C.; Rodrigues, Laura C.] London Sch Hyg & Trop Med, Dept Infect Dis Epidemiol, London, England; [O'Brien, Sarah J.] Univ Manchester, Sch Translat Med, Manchester M13 9PL, Lancs, England; [O'Brien, Sarah J.] Manchester Acad Hlth Sci Ctr, Manchester, Lancs, England; [Tompkins, David S.] Hlth Protect Agcy, Reg Lab, Leeds, W Yorkshire, England; [Bolton, Frederick J.; Mather, Katherine; Ridge, Alan; Wood, Bernard] Hlth Protect Agcy, Reg Lab, Manchester, Lancs, England; [Berry, Lisa; Choudhury, Dalia; Halstead, Fenella; Iturriza-Gomara, Miren; Wain, John; Gray, James J.] Hlth Protect Agcy, Ctr Infect, London, England; [Rait, Greta] UCL, Dept Primary Care & Populat Hlth, London WC1E 6BT, England; [Gray, James J.] Univ E Anglia, Sch Med Hlth Policy & Practice, Norwich NR4 7TJ, Norfolk, England",University of London; London School of Hygiene & Tropical Medicine; University of Manchester; University of Manchester; Health Protection Agency; Health Protection Agency; Health Protection Agency; University of London; University College London; University of East Anglia,"O'Brien, SJ (corresponding author), Univ Liverpool, Inst Infect & Global Hlth, Leahurst Campus,Chester High Rd, Neston CH64 7TE, England.",s.j.obrien@liverpool.ac.uk,,,,,,,,118,127,,,,,,,,,,,MAY 1,2012,54,9,,,,,1275,1286,,10.1093/cid/cis028,http://dx.doi.org/10.1093/cid/cis028,,,,,,,,,,,,2024-11-27,WOS:000302805700013,View Full Record in Web of Science
J,"Müller, L; Korsgaard, H; Ethelberg, S",,,,"Muller, L.; Korsgaard, H.; Ethelberg, S.",,,Burden of acute gastrointestinal illness in Denmark 2009: a population-based telephone survey,EPIDEMIOLOGY AND INFECTION,,,,Article,,,,,,,,"A cross-sectional telephone survey was conducted in Denmark throughout 2009 to determine the incidence of acute gastrointestinal illness (AGI). Using the Danish population register, a random population sample stratified by gender and age groups was selected and mobile or landline phone numbers found. Representative numbers of interviews were performed by gender, age group and month. A recently proposed international case definition of AGI, including cases with diarrhoea and/or vomiting in a 4-week recall period, was used. A total of 1853 individuals were included and 206 (11.1%) fulfilled the case definition; 78% reported diarrhoea. This corresponds to an overall standardized incidence rate of 1.4 (95% CI 1.2-1.6) episodes of AGI per person-year. The incidence rate was generally higher in the younger age groups; only being 2.3, 1.9 and 0.80 per person-year in the 0-9, 10-39 and >= 40 years age groups, respectively. The incidence rate estimates were considerably higher when calculated from shorter recall periods.","[Muller, L.; Ethelberg, S.] Statens Serum Inst, Dept Epidemiol, DK-2300 Copenhagen S, Denmark; [Korsgaard, H.] Tech Univ, Natl Food Inst, Div Microbiol & Risk Assessment, Copenhagen, Denmark; [Ethelberg, S.] Statens Serum Inst, Dept Microbiol Surveillance & Res, DK-2300 Copenhagen S, Denmark",Statens Serum Institut; Technical University of Denmark; Statens Serum Institut,"Ethelberg, S (corresponding author), Statens Serum Inst, Dept Epidemiol, Artillerivej 5, DK-2300 Copenhagen S, Denmark.",set@ssi.dk,,,,,,,,43,51,,,,,,,,,,,FEB,2012,140,2,,,,,290,298,,10.1017/S0950268811000471,http://dx.doi.org/10.1017/S0950268811000471,,,,,,,,,,,,2024-11-27,WOS:000299655200012,View Full Record in Web of Science
J,"Tam, CC; Rodrigues, LC; Viviani, L; Dodds, JP; Evans, MR; Hunter, PR; Gray, JJ; Letley, LH; Rait, G; Tompkins, DS; O'Brien, SJ",,,,"Tam, Clarence C.; Rodrigues, Laura C.; Viviani, Laura; Dodds, Julie P.; Evans, Meirion R.; Hunter, Paul R.; Gray, Jim J.; Letley, Louise H.; Rait, Greta; Tompkins, David S.; O'Brien, Sarah J.",,IID2 Study Executive Comm,Longitudinal study of infectious intestinal disease in the UK (IID2 study): incidence in the community and presenting to general practice,GUT,,,,Article,,,,,,,,"Objectives To estimate, overall and by organism, the incidence of infectious intestinal disease (IID) in the community, presenting to general practice (GP) and reported to national surveillance. Design Prospective, community cohort study and prospective study of GP presentation conducted between April 2008 and August 2009. Setting Eighty-eight GPs across the UK recruited from the Medical Research Council General Practice Research Framework and the Primary Care Research Networks. Participants 6836 participants registered with the 88 participating practices in the community study; 991 patients with UK-acquired IID presenting to one of 37 practices taking part in the GP presentation study. Main outcome measures IID rates in the community, presenting to GP and reported to national surveillance, overall and by organism; annual IID cases and GP consultations by organism. Results The overall rate of IID in the community was 274 cases per 1000 person-years (95% CI 254 to 296); the rate of GP consultations was 17.7 per 1000 person-years (95% CI 14.4 to 21.8). There were 147 community cases and 10 GP consultations for every case reported to national surveillance. Norovirus was the most common organism, with incidence rates of 47 community cases per 1000 person-years and 2.1 GP consultations per 1000 person-years. Campylobacter was the most common bacterial pathogen, with a rate of 9.3 cases per 1000 person-years in the community, and 1.3 GP consultations per 1000 person-years. We estimate that there are up to 17 million sporadic, community cases of IID and 1 million GP consultations annually in the UK. Of these, norovirus accounts for 3 million cases and 130 000 GP consultations, and Campylobacter is responsible for 500 000 cases and 80 000 GP consultations. Conclusions IID poses a substantial community and healthcare burden in the UK. Control efforts must focus particularly on reducing the burden due to Campylobacter and enteric viruses.","[Tam, Clarence C.] Univ London London Sch Hyg & Trop Med, Fac Epidemiol & Populat Hlth, Dept Infect Dis Epidemiol, London WC1E 7HT, England",University of London; London School of Hygiene & Tropical Medicine,"Tam, CC (corresponding author), Univ London London Sch Hyg & Trop Med, Fac Epidemiol & Populat Hlth, Dept Infect Dis Epidemiol, Keppel St, London WC1E 7HT, England.",clarence.tam@lshtm.ac.uk,,,,,,,,410,435,,,,,,,,,,,JAN,2012,61,1,,,,,69,77,,10.1136/gut.2011.238386,http://dx.doi.org/10.1136/gut.2011.238386,,,,,,,,,,,,2024-11-27,WOS:000298179200011,View Full Record in Web of Science
